{"protocol":"focus-trace-hermetic-response-v4","reader_id":"reader_hft_a","focus_ref":"79:46","trace_kind":"reconstructed","baseline_models":[{"model_id":"B_short_dayparts","confidence":"strong","focus_anchor":"يَوْمَ ... لَمْ يَلْبَثُوا إِلَّا عَشِيَّةً أَوْ ضُحَاهَا","mechanism":"The encounter-day supplies the vantage point while residence is measured against either of two bounded day-parts, compressing an unspecified stay without assigning it a computed chronology.","activation_trace":[{"source_ref":"79:46","root":"ي و م","source_word_indices":["2"],"mapped_root_id":"root_001700","branch_id":"B002","role":"A day as an unspecified duration supplies the retrospective scale."},{"source_ref":"79:46","root":"ل ب ث","source_word_indices":["5"],"mapped_root_id":"root_001339","branch_id":"B001","role":"Residence or staying is the span compressed by the simile."},{"source_ref":"79:46","root":"ع ش و","source_word_indices":["7"],"mapped_root_id":"root_001017","branch_id":"B004","role":"Evening supplies one bounded edge of a day."},{"source_ref":"79:46","root":"ض ح و","source_word_indices":["9"],"mapped_root_id":"root_000904","branch_id":"B001","role":"Forenoon supplies the alternative bounded daytime measure."}],"changed_reading":{"before":"They remained only a short time.","after":"From encounter, their whole residence feels no longer than one evening or that day's forenoon; the alternatives mark scale rather than a computed total."}}],"context_deltas":[{"model_id":"D_created_light_cycle","status":"revised","confidence":"strong","trigger_roots":["غ ط ش","ل ي ل","خ ر ج","ض ح و"],"mechanism":"The exact ضُحَاهَا echo links the final forenoon to the earlier darkening of night and bringing out of forenoon; the whole residence is miniaturized within a governed light-cycle.","activation_trace":[{"source_ref":"79:29","root":"غ ط ش","source_word_indices":["1"],"mapped_root_id":"root_001094","branch_id":"B001","role":"Darkening night makes the dark phase an operation, not a neutral clock label."},{"source_ref":"79:29","root":"ل ي ل","source_word_indices":["2"],"mapped_root_id":"root_001392","branch_id":"B001","role":"Night and darkness establish one pole of the cycle."},{"source_ref":"79:29","root":"خ ر ج","source_word_indices":["3"],"mapped_root_id":"root_000400","branch_id":"B002","role":"Bringing from concealment makes daylight's appearance an operation."},{"source_ref":"79:29","root":"ض ح و","source_word_indices":["4"],"mapped_root_id":"root_000904","branch_id":"B005","role":"The exact focus-word echo contributes forenoon brightness as the revealed pole."},{"source_ref":"79:46","root":"ض ح و","source_word_indices":["9"],"mapped_root_id":"root_000904","branch_id":"B001","role":"The focus forenoon receives the earlier created-cycle resonance."}],"structural_cues":["79:29 and 79:46 repeat ضُحَاهَا with the same suffix; the former coordinates darkening night and bringing out forenoon, while the latter coordinates evening or its forenoon."],"reader_inference":"The packet supplies the exact echo and darkening/bringing-out sequence; I infer that the final scale evokes an operated cycle. The live alternative is ordinary reuse of time-of-day language.","changed_reading":{"before":"Evening and forenoon are generic short units.","after":"They are edges of a created light-cycle, and the entire residence is reduced to one phase whose darkness and brightness are brought about."}},{"model_id":"D_remembered_exposure","status":"revised","confidence":"strong","trigger_roots":["ذ ك ر","ب ر ز","ر ء ي","ء ث ر","د ن و"],"mechanism":"Remembered striving precedes uncovered consequence and preference for worldly life; when the focus repeats seeing and compresses the stay, shortness revalues intact memory rather than resulting from amnesia.","activation_trace":[{"source_ref":"79:35","root":"ذ ك ر","source_word_indices":["2"],"mapped_root_id":"root_000516","branch_id":"B003","role":"Retrieval after or with forgetting supplies explicit recovery of what was done."},{"source_ref":"79:36","root":"ب ر ز","source_word_indices":["1"],"mapped_root_id":"root_000105","branch_id":"B001","role":"Uncovering makes consequence manifest before the estimate."},{"source_ref":"79:36","root":"ر ء ي","source_word_indices":["4"],"mapped_root_id":"root_000531","branch_id":"B001","role":"Direct sight links exposed consequence to the focus act of seeing."},{"source_ref":"79:38","root":"ء ث ر","source_word_indices":["1"],"mapped_root_id":"root_000011","branch_id":"B005","role":"Preference by choice makes worldly life an invested object, not mere elapsed time."},{"source_ref":"79:38","root":"د ن و","source_word_indices":["3"],"mapped_root_id":"root_000493","branch_id":"B002","role":"The worldly or lower designation marks the chosen life's relative rank."},{"source_ref":"79:46","root":"ر ء ي","source_word_indices":["3"],"mapped_root_id":"root_000531","branch_id":"B001","role":"Repeated sight supplies the final vantage for re-scaling remembered life."},{"source_ref":"79:46","root":"ل ب ث","source_word_indices":["5"],"mapped_root_id":"root_001339","branch_id":"B001","role":"The former residence contracts despite the retained record."}],"structural_cues":["79:35 makes recollection precede 79:36 exposure; 79:38 names the chosen object as worldly life before 79:46 repeats seeing."],"reader_inference":"The packet supplies remembered striving, exposed consequence, sight, and preference; I infer that memory survives while encounter changes valuation and scale. Alternatively, these scenes may be independent and shortness merely retrospective.","changed_reading":{"before":"The stay seems short because the past has become vague or forgotten.","after":"They remember what they did, yet the chosen worldly residence contracts once consequence is uncovered; shortness is a verdict of exposure, not amnesia."}},{"model_id":"D_mooring_to_encounter","status":"new","confidence":"strong","trigger_roots":["س ء ل","ر س و","ذ ك ر","ن ه ي","ن ذ ر"],"mechanism":"The request to moor the Hour is redirected from human chronology to its Lord-held endpoint and warning; the focus then gives experiential certainty at seeing, where prior time loses scale.","activation_trace":[{"source_ref":"79:42","root":"س ء ل","source_word_indices":["1"],"mapped_root_id":"root_000661","branch_id":"B001","role":"Questioning initiates the demand for temporal placement."},{"source_ref":"79:42","root":"ر س و","source_word_indices":["5"],"mapped_root_id":"root_000564","branch_id":"B002","role":"Anchorage frames the demand as fixing the Hour in chronology."},{"source_ref":"79:43","root":"ذ ك ر","source_word_indices":["4"],"mapped_root_id":"root_000516","branch_id":"B009","role":"Reminder language makes the event present without dating it."},{"source_ref":"79:44","root":"ن ه ي","source_word_indices":["3"],"mapped_root_id":"root_001560","branch_id":"B002","role":"An endpoint relocates final determination to the Lord."},{"source_ref":"79:45","root":"ن ذ ر","source_word_indices":["3"],"mapped_root_id":"root_001488","branch_id":"B001","role":"Warning supplies the practical response in place of a date."},{"source_ref":"79:46","root":"ر ء ي","source_word_indices":["3"],"mapped_root_id":"root_000531","branch_id":"B001","role":"Seeing replaces speculative placement with direct certainty."}],"structural_cues":["The sequence asks أَيَّانَ مُرْسَاهَا, redirects مُنتَهَاهَا to the Lord, limits the messenger to warning, then shifts to يَوْمَ يَرَوْنَهَا."],"reader_inference":"The packet supplies request, anchorage, endpoint, warning, and sight; I infer redirection from calendar knowledge to encounter-knowledge. Alternatively, withheld dating and the short-stay simile may be adjacent but independent.","changed_reading":{"before":"The verse simply states how brief life will seem.","after":"It answers the demand to moor the Hour on a human timeline: its date is withheld, but seeing it collapses prior time."}}],"surprising_valid_outliers":[{"outlier_id":"O_kinetic_anti_lingering","confidence":"exploratory","containment":"Surprising because it carries a peripheral rushing-motion branch of ن ز ع into the opening without identifying its agents; valid as a formal contrast between advance and the focus root's stopping. Render only as kinetic resonance, not translation or referent assignment.","focus_anchor":"لَمْ يَلْبَثُوا against the opening sequence's motion forms","activation_trace":[{"source_ref":"79:1","root":"ن ز ع","source_word_indices":["1"],"mapped_root_id":"root_001489","branch_id":"B012","role":"A rushing-travel branch supplies an exploratory initial impulse."},{"source_ref":"79:4","root":"س ب ق","source_word_indices":["1","2"],"mapped_root_id":"root_000671","branch_id":"B001","role":"Repeated advance and racing make forward motion explicit."},{"source_ref":"79:46","root":"ل ب ث","source_word_indices":["5"],"mapped_root_id":"root_001339","branch_id":"B002","role":"Stopping and slowness anchor the outlier in the focus."}],"changed_reading":{"before":"The last line's short stay is isolated from the opening.","after":"The opening rush can resonate at closure as an anti-lingering arc: movement outruns stopping until residence seems negligible."}}],"summary":{"strongest_changes":["Remembered striving still contracts, making shortness a re-scaling of intact memory.","The exact ضُحَاهَا echo binds the estimate to the operated dark-light cycle of 79:29.","The mooring-and-endpoint sequence makes 79:46 an experiential answer to the demand for a date."],"what_was_special":"Created-cycle scaling, evaluative exposure, and rhetorical redirection remain distinct coexisting mechanisms without selecting one chronology.","remaining_uncertainties":["The focus pronoun's antecedent and the precise stay measured are not fixed by the inventories alone.","The kinetic activation uses non-primary branch reach and should retain its stated containment."]}}
